{"candidate_set_id":"property-candidates:repair-3bf0ee217ab1483495599c17cb8615da:add-column-1:claim-001","candidates":[{"applicable_classes":["IfcColumn"],"candidate_id":"candidate:1:ifc2x3:Pset_ColumnCommon.Reference","canonical_path":"Pset_ColumnCommon.Reference","definition":"Reference ID for this specified type in this project (e.g. type 'A-1')","property_name":"Reference","rank":1,"record_id":"ifc2x3:Pset_ColumnCommon.Reference","score":0.5098608486261902,"set_name":"Pset_ColumnCommon","source":{"kind":"ifc2x3_psd","reference":"R2x3_TC1/psd/IfcSharedBldgElements/Pset_ColumnCommon.xml"},"standard_status":"standard","template_type":"TypePropertySingleValue","unit":null,"value_type":"IfcIdentifier"},{"applicable_classes":["IfcColumn"],"candidate_id":"candidate:2:ifc2x3:Pset_ColumnCommon.LoadBearing","canonical_path":"Pset_ColumnCommon.LoadBearing","definition":"Indicates whether the object is intended to carry loads (TRUE) or not (FALSE).","property_name":"LoadBearing","rank":2,"record_id":"ifc2x3:Pset_ColumnCommon.LoadBearing","score":0.49994046614935117,"set_name":"Pset_ColumnCommon","source":{"kind":"ifc2x3_psd","reference":"R2x3_TC1/psd/IfcSharedBldgElements/Pset_ColumnCommon.xml"},"standard_status":"standard","template_type":"TypePropertySingleValue","unit":null,"value_type":"IfcBoolean"},{"applicable_classes":["IfcColumn"],"candidate_id":"candidate:3:ifc2x3:Pset_ReinforcementBarPitchOfColumn.Description","canonical_path":"Pset_ReinforcementBarPitchOfColumn.Description","definition":"Description of the reinforcement.","property_name":"Description","rank":3,"record_id":"ifc2x3:Pset_ReinforcementBarPitchOfColumn.Description","score":0.4877010771794026,"set_name":"Pset_ReinforcementBarPitchOfColumn","source":{"kind":"ifc2x3_psd","reference":"R2x3_TC1/psd/IfcStructuralElementsDomain/Pset_ReinforcementBarPitchOfColumn.xml"},"standard_status":"standard","template_type":"TypePropertySingleValue","unit":null,"value_type":"IfcText"},{"applicable_classes":["IfcColumn"],"candidate_id":"candidate:4:ifc2x3:Pset_ReinforcementBarPitchOfColumn.Reference","canonical_path":"Pset_ReinforcementBarPitchOfColumn.Reference","definition":"A descriptive label for the general reinforcement type.","property_name":"Reference","rank":4,"record_id":"ifc2x3:Pset_ReinforcementBarPitchOfColumn.Reference","score":0.4642374058521642,"set_name":"Pset_ReinforcementBarPitchOfColumn","source":{"kind":"ifc2x3_psd","reference":"R2x3_TC1/psd/IfcStructuralElementsDomain/Pset_ReinforcementBarPitchOfColumn.xml"},"standard_status":"standard","template_type":"TypePropertySingleValue","unit":null,"value_type":"IfcLabel"},{"applicable_classes":["IfcElement"],"candidate_id":"candidate:5:ifc2x3:Pset_QuantityTakeOff.LocalContext","canonical_path":"Pset_QuantityTakeOff.LocalContext","definition":"Local context information for the take-off quantity, if multiple information items are passed, then the property shall be indexed, e.g. LocalContext1, LocalContext2, …","property_name":"LocalContext","rank":5,"record_id":"ifc2x3:Pset_QuantityTakeOff.LocalContext","score":0.4504378704425449,"set_name":"Pset_QuantityTakeOff","source":{"kind":"ifc2x3_psd","reference":"R2x3_TC1/psd/IfcProductExtension/Pset_QuantityTakeOff.xml"},"standard_status":"standard","template_type":"TypePropertySingleValue","unit":null,"value_type":"IfcText"}],"collection_version":"ifc2x3-property-vector/0.2","corpus_version":"ifc2x3-property-records/0.2","document_renderer_version":"property-record-text/0.1","embedding_model":{"model_id":"BAAI/bge-m3","model_version":"BAAI-bge-m3-local/phase12.1"},"query_id":"property-query:repair-3bf0ee217ab1483495599c17cb8615da:add-column-1:claim-001","schema_version":"text2ifc/ifc-property-candidate-set/0.1"}
