{"candidate_set_id":"property-candidates:repair-ced900798d8c479da01c5d903cc7d061:set-window-fire-rating-1:claim-001","candidates":[{"applicable_classes":["IfcElement","IfcSpatialStructureElement"],"candidate_id":"candidate:1:ifc2x3:Pset_FireRatingProperties.SurfaceSpreadOfFlame","canonical_path":"Pset_FireRatingProperties.SurfaceSpreadOfFlame","definition":"Surface spread of flame characteristics.","property_name":"SurfaceSpreadOfFlame","rank":1,"record_id":"ifc2x3:Pset_FireRatingProperties.SurfaceSpreadOfFlame","score":0.5364969536522899,"set_name":"Pset_FireRatingProperties","source":{"kind":"ifc2x3_psd","reference":"R2x3_TC1/psd/IfcSharedBldgServiceElements/Pset_FireRatingProperties.xml"},"standard_status":"standard","template_type":"TypePropertySingleValue","unit":null,"value_type":"IfcLabel"},{"applicable_classes":["IfcWindow"],"candidate_id":"candidate:2:ifc2x3:Pset_WindowCommon.FireRating","canonical_path":"Pset_WindowCommon.FireRating","definition":"Fire rating for this object.\nIt is given according to the national fire safety classification.","property_name":"FireRating","rank":2,"record_id":"ifc2x3:Pset_WindowCommon.FireRating","score":0.5349825789673885,"set_name":"Pset_WindowCommon","source":{"kind":"ifc2x3_psd","reference":"R2x3_TC1/psd/IfcSharedBldgElements/Pset_WindowCommon.xml"},"standard_status":"standard","template_type":"TypePropertySingleValue","unit":null,"value_type":"IfcLabel"},{"applicable_classes":["IfcObject"],"candidate_id":"candidate:3:ifc2x3:Pset_Risk.SubNatureOfRisk1","canonical_path":"Pset_Risk.SubNatureOfRisk1","definition":"A first subsidiary value that might be assigned to designate a more specific type of risk.\n\nNOTE: Nature of risk may be identified in various ways depending upon the place where risk assessment takes place and according to local agreement. This property set allows for a generic nature of risk and up to two subsidiary natures. An example might be 'causing injury and damage'","property_name":"SubNatureOfRisk1","rank":3,"record_id":"ifc2x3:Pset_Risk.SubNatureOfRisk1","score":0.48162549897374735,"set_name":"Pset_Risk","source":{"kind":"ifc2x3_psd","reference":"R2x3_TC1/psd/IfcSharedFacilitiesElements/Pset_Risk.xml"},"standard_status":"standard","template_type":"TypePropertySingleValue","unit":null,"value_type":"IfcLabel"},{"applicable_classes":["IfcWindow"],"candidate_id":"candidate:4:ifc2x3:Pset_WindowCommon.Reference","canonical_path":"Pset_WindowCommon.Reference","definition":"Reference ID for this specified type in this project (e.g. type 'A-1')","property_name":"Reference","rank":4,"record_id":"ifc2x3:Pset_WindowCommon.Reference","score":0.47705245358689813,"set_name":"Pset_WindowCommon","source":{"kind":"ifc2x3_psd","reference":"R2x3_TC1/psd/IfcSharedBldgElements/Pset_WindowCommon.xml"},"standard_status":"standard","template_type":"TypePropertySingleValue","unit":null,"value_type":"IfcIdentifier"},{"applicable_classes":["IfcWindow"],"candidate_id":"candidate:5:ifc2x3:Pset_WindowCommon.SecurityRating","canonical_path":"Pset_WindowCommon.SecurityRating","definition":"Index based rating system indicating security level.\nIt is giving according to the national building code.","property_name":"SecurityRating","rank":5,"record_id":"ifc2x3:Pset_WindowCommon.SecurityRating","score":0.46663021741828026,"set_name":"Pset_WindowCommon","source":{"kind":"ifc2x3_psd","reference":"R2x3_TC1/psd/IfcSharedBldgElements/Pset_WindowCommon.xml"},"standard_status":"standard","template_type":"TypePropertySingleValue","unit":null,"value_type":"IfcLabel"}],"collection_version":"ifc2x3-property-vector/0.2","corpus_version":"ifc2x3-property-records/0.2","document_renderer_version":"property-record-text/0.1","embedding_model":{"model_id":"BAAI/bge-m3","model_version":"BAAI-bge-m3-local/phase12.1"},"query_id":"property-query:repair-ced900798d8c479da01c5d903cc7d061:set-window-fire-rating-1:claim-001","schema_version":"text2ifc/ifc-property-candidate-set/0.1"}
