{"candidate_set_id":"property-candidates:repair-e73f20cc91c94f398145e952b2bdf074:set-door-fire-rating-1:claim-001","candidates":[{"applicable_classes":["IfcDoor"],"candidate_id":"candidate:1:ifc2x3:Pset_DoorCommon.FireRating","canonical_path":"Pset_DoorCommon.FireRating","definition":"Fire rating for this object.\nIt is given according to the national fire safety classification.","property_name":"FireRating","rank":1,"record_id":"ifc2x3:Pset_DoorCommon.FireRating","score":0.5678902469201849,"set_name":"Pset_DoorCommon","source":{"kind":"ifc2x3_psd","reference":"R2x3_TC1/psd/IfcSharedBldgElements/Pset_DoorCommon.xml"},"standard_status":"standard","template_type":"TypePropertySingleValue","unit":null,"value_type":"IfcLabel"},{"applicable_classes":["IfcElement","IfcSpatialStructureElement"],"candidate_id":"candidate:2:ifc2x3:Pset_FireRatingProperties.SurfaceSpreadOfFlame","canonical_path":"Pset_FireRatingProperties.SurfaceSpreadOfFlame","definition":"Surface spread of flame characteristics.","property_name":"SurfaceSpreadOfFlame","rank":2,"record_id":"ifc2x3:Pset_FireRatingProperties.SurfaceSpreadOfFlame","score":0.538713145480276,"set_name":"Pset_FireRatingProperties","source":{"kind":"ifc2x3_psd","reference":"R2x3_TC1/psd/IfcSharedBldgServiceElements/Pset_FireRatingProperties.xml"},"standard_status":"standard","template_type":"TypePropertySingleValue","unit":null,"value_type":"IfcLabel"},{"applicable_classes":["IfcDoor"],"candidate_id":"candidate:3:ifc2x3:Pset_DoorCommon.Reference","canonical_path":"Pset_DoorCommon.Reference","definition":"Reference ID for this specified type in this project (e.g. type 'A-1')","property_name":"Reference","rank":3,"record_id":"ifc2x3:Pset_DoorCommon.Reference","score":0.5242153785490011,"set_name":"Pset_DoorCommon","source":{"kind":"ifc2x3_psd","reference":"R2x3_TC1/psd/IfcSharedBldgElements/Pset_DoorCommon.xml"},"standard_status":"standard","template_type":"TypePropertySingleValue","unit":null,"value_type":"IfcIdentifier"},{"applicable_classes":["IfcDoor"],"candidate_id":"candidate:4:ifc2x3:Pset_DoorCommon.SecurityRating","canonical_path":"Pset_DoorCommon.SecurityRating","definition":"Index based rating system indicating security level.\nIt is giving according to the national building code.","property_name":"SecurityRating","rank":4,"record_id":"ifc2x3:Pset_DoorCommon.SecurityRating","score":0.5086756422785697,"set_name":"Pset_DoorCommon","source":{"kind":"ifc2x3_psd","reference":"R2x3_TC1/psd/IfcSharedBldgElements/Pset_DoorCommon.xml"},"standard_status":"standard","template_type":"TypePropertySingleValue","unit":null,"value_type":"IfcLabel"},{"applicable_classes":["IfcDoor"],"candidate_id":"candidate:5:ifc2x3:Pset_DoorCommon.FireExit","canonical_path":"Pset_DoorCommon.FireExit","definition":"Indication whether this object is designed to serve as an exit in the case of fire (TRUE) or not (FALSE).\nHere it defines an exit door in accordance to the national building code.","property_name":"FireExit","rank":5,"record_id":"ifc2x3:Pset_DoorCommon.FireExit","score":0.5002464978389509,"set_name":"Pset_DoorCommon","source":{"kind":"ifc2x3_psd","reference":"R2x3_TC1/psd/IfcSharedBldgElements/Pset_DoorCommon.xml"},"standard_status":"standard","template_type":"TypePropertySingleValue","unit":null,"value_type":"IfcBoolean"}],"collection_version":"ifc2x3-property-vector/0.2","corpus_version":"ifc2x3-property-records/0.2","document_renderer_version":"property-record-text/0.1","embedding_model":{"model_id":"BAAI/bge-m3","model_version":"BAAI-bge-m3-local/phase12.1"},"query_id":"property-query:repair-e73f20cc91c94f398145e952b2bdf074:set-door-fire-rating-1:claim-001","schema_version":"text2ifc/ifc-property-candidate-set/0.1"}
